{
  "schema_version": "2.0.0",
  "debate_id": "nvda_structural_vs_cyclical_2024",
  "run_id": "c4d2a9f0-7e12-4b9a-8f33-2e9a1c7d5b88",
  "evaluation_mode": "posthoc",
  "run_metadata": {
    "generation_mode": "live",
    "global_model_name": "multi-agent",
    "temperature": 0.7,
    "top_p": 1.0,
    "seed": null,
    "max_tokens": 4096,
    "prompt_bundle_version": "debate_bundle_v3_natural",
    "reasoning_regime": "natural",
    "notes": "Natural reasoning regime example. Posthoc only."
  },
  "metadata": {
    "created_at": "2026-02-20T03:15:00Z",
    "scenario_id": "NVDA_AI_INFRASTRUCTURE_DEBATE",
    "task_type": "equity_analysis",
    "market_context": "Debate on NVIDIA valuation under AI infrastructure expansion",
    "notes": "Natural regime. No explicit structured scaffolding."
  },
  "participants": [
    {
      "agent_id": "NVDA_BEAR_GPT4o",
      "role": "bear",
      "model_name": "gpt-4o",
      "system_prompt_version": "bear_natural_v3"
    },
    {
      "agent_id": "NVDA_BULL_Claude",
      "role": "bull",
      "model_name": "claude-sonnet-4",
      "system_prompt_version": "bull_natural_v3"
    }
  ],
  "turns": [
    {
      "turn_id": "1e8f5b22-9a4c-4d7a-b1f8-3c6a7e2b9d01",
      "turn_index": 0,
      "round_index": 1,
      "speaker_id": "NVDA_BEAR_GPT4o",
      "turn_type": "argument",
      "recommendation": {
        "action": "SHORT",
        "position_size_pct_min": 0.05,
        "position_size_pct_max": 0.07,
        "horizon_days_min": 90,
        "horizon_days_max": 180,
        "conviction": 0.7,
        "raw_text": "SHORT NVDA (5–7% position), horizon 3–6 months, conviction 0.70"
      },
      "content": "NVIDIA’s current valuation appears to embed a near-perfect continuation of extraordinary AI-driven growth. In situations where expectations are elevated, the risk is not collapse but deceleration. If revenue growth moderates from extreme acceleration to merely strong growth, valuation multiples can compress disproportionately because the premium was assigned under assumptions of continued hyper-expansion. A further concern is demand concentration: a relatively small group of hyperscalers drives incremental demand and possesses significant bargaining leverage. Over time, such buyers may diversify suppliers or internalize components of the stack, particularly through custom silicon programs, which could gradually pressure margins. While CUDA’s ecosystem creates meaningful switching costs, ecosystem advantages are not static. Improvements in tooling abstractions and maturation of alternative accelerators could reduce switching friction over multiple quarters. This thesis would weaken if forward bookings and guidance continue accelerating beyond the initial buildout phase and margins remain structurally elevated despite buyer concentration. Infrastructure importance alone does not guarantee correct pricing; the trade concerns the gap between implied growth expectations and what can realistically be delivered over the next several quarters."
    },
    {
      "turn_id": "5b3c7d91-8f4a-4c2b-a6e7-9d2f1c3a4b55",
      "turn_index": 1,
      "round_index": 1,
      "speaker_id": "NVDA_BULL_Claude",
      "turn_type": "rebuttal",
      "recommendation": {
        "action": "BUY",
        "position_size_pct_min": 0.08,
        "position_size_pct_max": 0.12,
        "horizon_days_min": 365,
        "horizon_days_max": 730,
        "conviction": 0.8,
        "raw_text": "BUY NVDA (8–12% position), horizon 12–24 months, conviction 0.80"
      },
      "content": "The bearish framing treats NVIDIA primarily as a cyclical semiconductor name, whereas its current position more closely resembles a dominant infrastructure platform in a structural compute transition. CUDA’s advantage extends beyond hardware performance into ecosystem-level switching costs shaped by developer workflows, deployment pipelines, and operational reliability. Even if competitors offer lower-cost accelerators, the total cost of switching — retraining models, revalidating production systems, and absorbing operational risk — can exceed nominal chip savings. AI demand is increasingly tied to measurable productivity gains and competitive necessity; firms adopt not simply because conditions are favorable but because failing to adopt risks strategic disadvantage. Once hyperscalers commit to multi-year infrastructure expansion, procurement, integration, and deployment timelines create momentum that extends beyond a single earnings cycle. Premium valuation multiples can therefore remain rational if NVIDIA captures a disproportionate share of an expanding profit pool. This view would weaken if hyperscaler capital expenditures are broadly reduced, utilization declines materially, or a credible full-stack alternative demonstrates production-scale migration away from CUDA."
    }
  ]
}